id,conversation_id,created_at,date,time,timezone,user_id,username,name,place,tweet,language,mentions,urls,photos,replies_count,retweets_count,likes_count,hashtags,cashtags,link,retweet,quote_url,video,thumbnail,near,geo,source,user_rt_id,user_rt,retweet_id,reply_to,retweet_date,translate,trans_src,trans_dest
1445220435193257993,1445220413550649344,2021-10-05 02:52:57 UTC,2021-10-05,02:52:57,+0000,43074696,greenpeaceid,Greenpeace Indonesia,,"Selain menginjak warga, monster berbentuk gurita ini terlihat juga mencengkeram sejumlah sektor kehidupan rakyat seperti energi, pertanian, kebebasan berpendapat, kehidupan masyarakat adat, serta pelemahan terhadap KPK.  https://t.co/nK3goyErfk",in,[],[],['https://pbs.twimg.com/media/FA50U1xVgAc0jTa.jpg'],1,10,35,[],[],https://twitter.com/GreenpeaceID/status/1445220435193257993,False,,1,https://pbs.twimg.com/media/FA50U1xVgAc0jTa.jpg,,,,,,,[],,,,
1445203000482435074,1445203000482435074,2021-10-05 01:43:40 UTC,2021-10-05,01:43:40,+0000,1321595677458141185,edaz41135296,eyang kakung,,KPK LEMAH TUU..gara gara sapa,in,[],[],[],0,0,0,[],[],https://twitter.com/edaz41135296/status/1445203000482435074,False,https://twitter.com/rmol_id/status/1445191547373244420,0,,,,,,,,[],,,,
1445199539577626624,1445198857847992322,2021-10-05 01:29:55 UTC,2021-10-05,01:29:55,+0000,1150594673477480448,randyelred,Elred Randy Satria,,@Dennysiregar7 @KPK_RI Nah kan kebongkar jg busuknya kpk RI. Mana kmrn yg demo dibilang pelemahan. Emang uda lemah dr dulu. Bru demo. Itu yg gk lolos TWK tau 8 orang ini gk. Tp tau jg pasti sesama tmn gk berani,in,[],[],[],0,0,5,[],[],https://twitter.com/RandyElred/status/1445199539577626624,False,,0,,,,,,,,"[{'screen_name': 'Dennysiregar7', 'name': 'Denny siregar', 'id': '4780649298'}, {'screen_name': 'KPK_RI', 'name': 'KPK', 'id': '104714478'}]",,,,
1445191723106254848,1444907686512902146,2021-10-05 00:58:51 UTC,2021-10-05,00:58:51,+0000,1300740601646702594,erwien28651953,Erwien,,"@nazaqistsha Anda lagi framing juga kan,seolah olah anda paling hebat di KPK,seolah olah tanpa anda KPK lemah  😆😆😆😆😆😆setali tiga uang vel..",in,[],[],[],0,0,0,[],[],https://twitter.com/Erwien28651953/status/1445191723106254848,False,,0,,,,,,,,"[{'screen_name': 'nazaqistsha', 'name': 'novel baswedan', 'id': '139081308'}]",,,,
1445114970526531600,1444508119325839364,2021-10-04 19:53:52 UTC,2021-10-04,19:53:52,+0000,403994949,hilalsafari,Hilal Safary°,,@tatakhoiriyah faktanya memang KPK banyak madrunnya.  gak lolos TWK bukan krn kadrun tapi lemah dlm kesadaran berbangsa..,in,[],[],[],0,0,0,[],[],https://twitter.com/HilalSafari/status/1445114970526531600,False,,0,,,,,,,,"[{'screen_name': 'tatakhoiriyah', 'name': 'tata khoiriyah', 'id': '219932683'}]",,,,
1445044334932361216,1445036300193517568,2021-10-04 15:13:11 UTC,2021-10-04,15:13:11,+0000,1210542766515572737,mangomo9,Mangomo,,"@jaya_pancasila NB selalu membentuk opini dia hebat, bersih, tanpa dia KPK lemah, padahal dia punya kasus penyiksaan, dia membangun jaringan di internal KPK &amp; ke external agar dia bisa berbuat semaunya, ternyata Tuhan melindungi bangsa &amp; negara ini, NB dikick out dari KPK, anies bisa diperiksa.",in,[],[],[],0,0,6,[],[],https://twitter.com/Mangomo9/status/1445044334932361216,False,,0,,,,,,,,"[{'screen_name': 'jaya_pancasila', 'name': 'Jinggaviolet', 'id': '1323890136539525123'}]",,,,
1445028926502227975,1445028926502227975,2021-10-04 14:11:58 UTC,2021-10-04,14:11:58,+0000,4146240312,embah72,Abah,,"Kemarin KPK habis""an dikuasai kelompok Taliban hingga terkesan lemah. Akankan hal itu terjadi ditubuh Polri ?  ""Eks Pegawai KPK Siap Berdiskusi dengan Polri....""  https://t.co/kAEnKPT8hh",in,[],['https://www.beritasatu.com/nasional/836611/eks-pegawai-kpk-siap-berdiskusi-dengan-polri'],[],0,1,1,[],[],https://twitter.com/embah72/status/1445028926502227975,False,,0,,,,,,,,[],,,,
1444997592572596231,1444997592572596231,2021-10-04 12:07:27 UTC,2021-10-04,12:07:27,+0000,1027890075319689216,infoviralnewsid,I N F O V I R A L 🆕️™️,,Saya Vs Oligarki.   Aksi ini merupakan bagian dari aksi massa serentak dalam rangka pekan perlawanan.  Momentum ini bermula dari penolakan terhadap UU KPK yang dianggap merupakan pelemahan terhadap institusi antikorupsi tersebut.   #SayaVsOligarki  #MosiTidakPercaya  https://t.co/cKk9QZXqE4,in,[],[],[],1,4,6,"['sayavsoligarki', 'mositidakpercaya']",[],https://twitter.com/infoviralnewsid/status/1444997592572596231,False,,1,https://pbs.twimg.com/ext_tw_video_thumb/1444997393599004672/pu/img/d5K7AcBw_Rah9B-_.jpg,,,,,,,[],,,,
1444993860854185986,1444964839378468865,2021-10-04 11:52:37 UTC,2021-10-04,11:52:37,+0000,1439792108043337731,zuanci,Zuanci Mahir,,@KaredokLeunca__ @KPK_RI Ternyata memang skrng Lemah. Gampang di susupi.,in,[],[],[],0,0,0,[],[],https://twitter.com/zuanci/status/1444993860854185986,False,,0,,,,,,,,"[{'screen_name': 'KaredokLeunca__', 'name': 'JEPRET.!! KARET NA 2,SEUHAH..!!🔥🔥', 'id': '1271319727751610385'}, {'screen_name': 'KPK_RI', 'name': 'KPK', 'id': '104714478'}]",,,,
1444955574777511936,1444928187675254791,2021-10-04 09:20:29 UTC,2021-10-04,09:20:29,+0000,796648037837742080,tugunkri,NKRI,,"@CNNIndonesia Pantes saja kpk makin lemah , ternyata ada oknum antek koruptor.",in,[],[],[],0,0,0,[],[],https://twitter.com/tugunkri/status/1444955574777511936,False,,0,,,,,,,,"[{'screen_name': 'CNNIndonesia', 'name': 'CNN Indonesia', 'id': '17128975'}]",,,,
1444950781417820160,1444903472181116932,2021-10-04 09:01:26 UTC,2021-10-04,09:01:26,+0000,1358089964265721856,pecintakopi999,Pecinta Kopi,,"@QhiloAmumori14 @yusfi5150 @P_Eneste @febridiansyah @KPK_RI @DivHumas_Polri @Dennysiregar7 Percuma, Bang. Narasi dia lemah, ujungnya sarkas. Itu memang trade mark orang bloon &amp; makhluk yang tidur kepala di bawah.",in,[],[],[],2,0,2,[],[],https://twitter.com/PecintaKopi999/status/1444950781417820160,False,,0,,,,,,,,"[{'screen_name': 'QhiloAmumori14', 'name': 'Qhilo Amumori', 'id': '1357597916362231809'}, {'screen_name': 'yusfi5150', 'name': 'Ferry Bozzio', 'id': '2647128577'}, {'screen_name': 'P_Eneste', 'name': 'Lane Jae', 'id': '1173546073224122368'}, {'screen_name': 'febridiansyah', 'name': 'Febri Diansyah', 'id': '1038438863465664512'}, {'screen_name': 'KPK_RI', 'name': 'KPK', 'id': '104714478'}, {'screen_name': 'DivHumas_Polri', 'name': 'Divisi Humas Polri', 'id': '138290629'}, {'screen_name': 'Dennysiregar7', 'name': 'Denny siregar', 'id': '4780649298'}]",,,,
1444949897707339780,1444877858304782338,2021-10-04 08:57:56 UTC,2021-10-04,08:57:56,+0000,1227071804205699072,antdjun1,antdjun,,"@Dennysiregar7 @KPK_RI Inilah sisi hitam hukum &amp; keadilan di negeri ini!!! Org2 benar, lemah &amp; minoritas selalu ditindas para bajingan, penjahat &amp; kawanan anjing rakus haram jaddah!!! Parah cuk!!!",in,[],[],[],0,0,0,[],[],https://twitter.com/antdjun1/status/1444949897707339780,False,,0,,,,,,,,"[{'screen_name': 'Dennysiregar7', 'name': 'Denny siregar', 'id': '4780649298'}, {'screen_name': 'KPK_RI', 'name': 'KPK', 'id': '104714478'}]",,,,
1444921470296023047,1444603544275800066,2021-10-04 07:04:58 UTC,2021-10-04,07:04:58,+0000,1434397647004049408,syafirahamira2,Syafirah Amira,,@HasianaM Ga usah ngomong anda Fahri bertanggungjawab atas pelemahan KPK Koruptor sangat menikmati lemahnya KPK saat ini,in,[],[],[],0,0,0,[],[],https://twitter.com/SyafirahAmira2/status/1444921470296023047,False,,0,,,,,,,,"[{'screen_name': 'HasianaM', 'name': 'Hasiana Malinda', 'id': '1434694492028764164'}]",,,,
1444913440477220869,1444890632015671297,2021-10-04 06:33:04 UTC,2021-10-04,06:33:04,+0000,1413711379211554819,queena_rizt,Queena,,"@Dennysiregar7 @KPK_RI Yg lemah diinjak dan dibuang , kebaikan yg tak ada artinya",in,[],[],[],0,0,0,[],[],https://twitter.com/Queena_Rizt/status/1444913440477220869,False,,0,,,,,,,,"[{'screen_name': 'Dennysiregar7', 'name': 'Denny siregar', 'id': '4780649298'}, {'screen_name': 'KPK_RI', 'name': 'KPK', 'id': '104714478'}]",,,,
1444909428759662593,1444907686512902146,2021-10-04 06:17:07 UTC,2021-10-04,06:17:07,+0000,93762902,real_adhidompu,🅰Dℹ,,@nazaqistsha Skrg jauh lebih teratur dibandingkan dgn saat @nazaqistsha dan @febridiansyah masih didalam.  Prestasi yg dulu cm bisa nangkap koruptor tp pengembalian dana negara minim pdhal anggaran utk @KPK_RI sgt besar. Sementara pencegahanKorupsi GAGAL.  Trus ente2 framing KPK lemah?,in,"[{'screen_name': 'nazaqistsha', 'name': 'novel baswedan', 'id': '139081308'}, {'screen_name': 'febridiansyah', 'name': 'febri diansyah', 'id': '1038438863465664512'}, {'screen_name': 'kpk_ri', 'name': 'kpk', 'id': '104714478'}]",[],[],1,0,1,[],[],https://twitter.com/Real_AdhiDompu/status/1444909428759662593,False,,0,,,,,,,,"[{'screen_name': 'nazaqistsha', 'name': 'novel baswedan', 'id': '139081308'}]",,,,
1444900211122491394,1444877858304782338,2021-10-04 05:40:29 UTC,2021-10-04,05:40:29,+0000,44159563,peternickzaal,Peter Nicolaas Zaal,,"@AgastyArcanA @widiajaya88 @febridiansyah @Dennysiregar7 @KPK_RI @nazaqistsha @tatakhoiriyah Jawaban idiot tak buat maju siapapun , jawaban lemah !!",in,[],[],[],2,0,2,[],[],https://twitter.com/PeterNickZaal/status/1444900211122491394,False,,0,,,,,,,,"[{'screen_name': 'AgastyArcanA', 'name': 'AgastyA🛠️', 'id': '609961709'}, {'screen_name': 'widiajaya88', 'name': 'widiajaya🇮🇩🇮🇩🇮🇩', 'id': '786808239606280192'}, {'screen_name': 'febridiansyah', 'name': 'Febri Diansyah', 'id': '1038438863465664512'}, {'screen_name': 'Dennysiregar7', 'name': 'Denny siregar', 'id': '4780649298'}, {'screen_name': 'KPK_RI', 'name': 'KPK', 'id': '104714478'}, {'screen_name': 'nazaqistsha', 'name': 'novel baswedan', 'id': '139081308'}, {'screen_name': 'tatakhoiriyah', 'name': 'tata khoiriyah', 'id': '219932683'}]",,,,
1444896449053876224,1444896449053876224,2021-10-04 05:25:32 UTC,2021-10-04,05:25:32,+0000,1111595565232459776,kaca67890,Gatut Kaca,,"Dapat tawaran apa bung @Fahrihamzah dari Madam Bansos,...kasian kader anda @partaigeloraid di seluruh Indonesia jika menduduki menteri hasil reshuffle,tp brgkali ini reward atas perjuangan anda dlm pelemahan KPK.",in,"[{'screen_name': 'fahrihamzah', 'name': '#fahrihamzah2021', 'id': '120968478'}, {'screen_name': 'partaigeloraid', 'name': 'partai gelora indonesia', 'id': '1179718333605658624'}]",[],[],4,11,45,[],[],https://twitter.com/Kaca67890/status/1444896449053876224,False,,0,,,,,,,,[],,,,
1444895183795986438,1444890632015671297,2021-10-04 05:20:31 UTC,2021-10-04,05:20:31,+0000,1410758838001618945,iyanss11,Braxs 🇮🇩,,"@Dennysiregar7 @KPK_RI Nahhh dri situ aja KPK udh salah,brarti KPK sndiri yg lemah bukan di lemahkan.",in,[],[],[],0,0,0,[],[],https://twitter.com/Iyanss11/status/1444895183795986438,False,,0,,,,,,,,"[{'screen_name': 'Dennysiregar7', 'name': 'Denny siregar', 'id': '4780649298'}, {'screen_name': 'KPK_RI', 'name': 'KPK', 'id': '104714478'}]",,,,
1444865816575373317,1444624905576669187,2021-10-04 03:23:49 UTC,2021-10-04,03:23:49,+0000,1401803385381134336,arifuddinmisen1,Arifuddin Miseng,,"@OposisiCerdas Jika sipil dan oposisi mengatakan pejuang, maka pejabat mengatakan sebaliknya, seperti KPK. Menurut masyarakat yang terjadi adalah pelemahan tapi menurut pejabat adalah memperkuat, inilah hasil dari sistem demokrasi hanya untuk kepentingan pejabat sementara rakyat ditinggalkan.",in,[],[],[],0,0,0,[],[],https://twitter.com/ArifuddinMisen1/status/1444865816575373317,False,,0,,,,,,,,"[{'screen_name': 'OposisiCerdas', 'name': 'OposisiCerdas.com', 'id': '887743587579944960'}]",,,,
1444855738363367427,1444855738363367427,2021-10-04 02:43:46 UTC,2021-10-04,02:43:46,+0000,229832704,iwanalidarmawan,Iwan Ali Darmawan王阿力,,"Isu HTI &amp; Taliban, dianggap sebagai upaya pelemahan KPK.  ""Kawan-kawan sudah bisa menandai bahwa bila isu itu diembuskan, biasanya ada kepentingan mereka yang terganggu di KPK,"" kata Novel.",in,[],[],[],0,0,0,[],[],https://twitter.com/iwanalidarmawan/status/1444855738363367427,False,https://twitter.com/CNNIndonesia/status/1444852321679073283,0,,,,,,,,[],,,,
1444849680458813440,1444849680458813440,2021-10-04 02:19:42 UTC,2021-10-04,02:19:42,+0000,1413046308487655424,nusantaracofee,"N̷u̷s̷a̷n̷t̷a̷r̷a̷C̷o̷f̷e̷e̷ ☕ ,💯🇮🇩",,Isu pelemahan KPK melalui TWK tidak relevan.   #PONJagaProkes  https://t.co/tThyFPhCPY,in,[],[],['https://pbs.twimg.com/media/FA0jHfhVkAA4dx3.jpg'],0,0,0,['ponjagaprokes'],[],https://twitter.com/NusantaraCofee/status/1444849680458813440,False,,1,https://pbs.twimg.com/media/FA0jHfhVkAA4dx3.jpg,,,,,,,[],,,,
1444847267756724227,1444847267756724227,2021-10-04 02:10:07 UTC,2021-10-04,02:10:07,+0000,1413046308487655424,nusantaracofee,"N̷u̷s̷a̷n̷t̷a̷r̷a̷C̷o̷f̷e̷e̷ ☕ ,💯🇮🇩",,Tidak ada pelemahan KPK karena telah melalui tes TWK.  #PONJagaProkes  https://t.co/8yx6mpoTtJ,in,[],[],['https://pbs.twimg.com/media/FA0g7SMUcAIojMz.jpg'],0,0,0,['ponjagaprokes'],[],https://twitter.com/NusantaraCofee/status/1444847267756724227,False,,1,https://pbs.twimg.com/media/FA0g7SMUcAIojMz.jpg,,,,,,,[],,,,
1444847010746548236,1444847010746548236,2021-10-04 02:09:05 UTC,2021-10-04,02:09:05,+0000,1271691008665772032,amanatinstitute,amanatinstitute,,"Komisi Pemberantasan Korupsi mendapatkan sorotan atas kinerja pimpinan yang sekarang. “Katanya” menjadikan KPK menjadi bobrok dan lemah. Tapi disisi lain, Menko Mahfud MD klaim era Firli lebih baik.  Hemm, kalau menurut kawan-kawan? #amanatinstitute  https://t.co/tU5WVMvlal",in,[],[],"['https://pbs.twimg.com/media/FA0glfJVEAY1x0Q.jpg', 'https://pbs.twimg.com/media/FA0glfHVUAQqGda.jpg', 'https://pbs.twimg.com/media/FA0glgzVgAMkxGq.jpg', 'https://pbs.twimg.com/media/FA0gliOVQAICATL.jpg']",0,0,1,['amanatinstitute'],[],https://twitter.com/amanatinstitute/status/1444847010746548236,False,,1,https://pbs.twimg.com/media/FA0glfJVEAY1x0Q.jpg,,,,,,,[],,,,
1444844852932341762,1444844852932341762,2021-10-04 02:00:31 UTC,2021-10-04,02:00:31,+0000,1413046308487655424,nusantaracofee,"N̷u̷s̷a̷n̷t̷a̷r̷a̷C̷o̷f̷e̷e̷ ☕ ,💯🇮🇩",,"Tidak ada pelemahan KPK, justru KPK semakin profesional dan berani dalam memberantas korupsi di Indonesia.  #PONJagaProkes  https://t.co/ffCRwmScOf",in,[],[],['https://pbs.twimg.com/media/FA0eusqUYAQCCh9.jpg'],0,0,0,['ponjagaprokes'],[],https://twitter.com/NusantaraCofee/status/1444844852932341762,False,,1,https://pbs.twimg.com/media/FA0eusqUYAQCCh9.jpg,,,,,,,[],,,,
1444815949576638464,1444815933990522880,2021-10-04 00:05:40 UTC,2021-10-04,00:05:40,+0000,1330144760636596228,salamdaivaj,Salam1,,"Juga khawatir pemberantasan korupsi akan semakin tumpul setelah rangkaian pelemahan KPK mulai dari revisi UU KPK, pemilihan komisioner bermasalah hingga pemecatan pegawai KPK.  #TiadaHariTanpaRuwet #TiadaHariTanpaRuwet",in,[],[],[],1,0,0,"['tiadaharitanparuwet', 'tiadaharitanparuwet']",[],https://twitter.com/SalamDaivaJ/status/1444815949576638464,False,,0,,,,,,,,[],,,,
1444815941909450753,1444815933990522880,2021-10-04 00:05:38 UTC,2021-10-04,00:05:38,+0000,1330144760636596228,salamdaivaj,Salam1,,"Kini, ia khawatir KPK akan menjadi alat kepentingan untuk menyasar tokoh politik yang lemah sementara tokoh politik high profile tidak tersentuh.  #TiadaHariTanpaRuwet #TiadaHariTanpaRuwet",in,[],[],[],1,0,0,"['tiadaharitanparuwet', 'tiadaharitanparuwet']",[],https://twitter.com/SalamDaivaJ/status/1444815941909450753,False,,0,,,,,,,,[],,,,
1444813342854434822,1444813296758976513,2021-10-03 23:55:18 UTC,2021-10-03,23:55:18,+0000,1359083437420777478,salamdawwasj,Salam2,,"Mulai dari puluhan guru besar, mahasiswa, dan organisasi masyarakat sipil telah memberikan masukan tentang potensi pelemahan KPK di balik TWK, tetapi tidak direspons.  #TiadaHariTanpaRuwet #TiadaHariTanpaRuwet",in,[],[],[],1,0,0,"['tiadaharitanparuwet', 'tiadaharitanparuwet']",[],https://twitter.com/SalamDawwasJ/status/1444813342854434822,False,,0,,,,,,,,[],,,,
1444653518283968515,1444653518283968515,2021-10-03 13:20:13 UTC,2021-10-03,13:20:13,+0000,550306853,mabacakomunitas,Rumah Baca Komunitas,,Riset ini mendokumentasikan fenomena matinya demokrasi di tengah oligarki proponen omnibuslaw dan pelemahan KPK. Karya yang layak dibaca semua kalanggan termasuk kaum belia yang berminat menjadi bagian dari demos yang kritis dan progresif.  https://t.co/51ry0tWUbb,in,[],[],['https://pbs.twimg.com/media/FAxwt98UcAI9mv4.jpg'],0,0,0,[],[],https://twitter.com/MabacaKomunitas/status/1444653518283968515,False,,1,https://pbs.twimg.com/media/FAxwt98UcAI9mv4.jpg,,,,,,,[],,,,
1444602371661656066,1444601617131573252,2021-10-03 09:56:59 UTC,2021-10-03,09:56:59,+0000,1185460243565699072,sswangga,#LawanCovidLawanBuzzeRp,,"Ditambah banyaknya org² NU yg pakai narasi nasionalisme dan dapat jabatan strategis di pemerintah, maka sulit utk menempatkan posisi dan sikap NU ketika pelemahan KPK terjadi.",in,[],[],[],0,0,0,[],[],https://twitter.com/SSwangga/status/1444602371661656066,False,,0,,,,,,,,[],,,,
1444578289469689858,1444578271224471558,2021-10-03 08:21:17 UTC,2021-10-03,08:21:17,+0000,261581305,bempsiunair,BEM Psikologi UNAIR,,"Menyikapi hal-hal tersebut, kami dari Aliansi BEM se-Unair mengambil sikap atas Pemecatan Pegawai KPK dan juga Upaya Pelemahan Pemberantasan Korupsi di Indonesia.  #BEMKMFPsiUNAIR #KabinetSedarma #MelangkahBersama #SemarakkanJuang #DepartemenKastra",in,[],[],[],0,0,0,"['bemkmfpsiunair', 'kabinetsedarma', 'melangkahbersama', 'semarakkanjuang', 'departemenkastra']",[],https://twitter.com/bempsiUNAIR/status/1444578289469689858,False,,0,,,,,,,,[],,,,
1444578271224471558,1444578271224471558,2021-10-03 08:21:13 UTC,2021-10-03,08:21:13,+0000,261581305,bempsiunair,BEM Psikologi UNAIR,,[PERNYATAAN SIKAP: Pernyataan Sikap Aliansi BEM Se-UNAIR Mengenai Pemecatan Pegawai KPK dan Upaya Pelemahan Pemberantasan Korupsi]  https://t.co/FWZRyep7bO,in,[],[],"['https://pbs.twimg.com/media/FAwsDaeVIAE1uOp.jpg', 'https://pbs.twimg.com/media/FAwsD-FUYAgTpmW.jpg', 'https://pbs.twimg.com/media/FAwsEhQVgAcIC-R.jpg', 'https://pbs.twimg.com/media/FAwsE_HVgAQM5J9.jpg']",1,0,0,[],[],https://twitter.com/bempsiUNAIR/status/1444578271224471558,False,,1,https://pbs.twimg.com/media/FAwsDaeVIAE1uOp.jpg,,,,,,,[],,,,
1444554688699846661,1444442647528034309,2021-10-03 06:47:30 UTC,2021-10-03,06:47:30,+0000,2543676840,freddyhutasoit3,freddyhutasoit,,"@yudiharahap46 Semakin semangat untuk memberantas korupsi,juga semakin semangat mengungkap permainan  TWK yang disisipkan ini.Mari membuktikan bahwa KPK di kepemimpinan Firli cs lemah,dan siapa dibalik TWK ini.",in,[],[],[],0,0,0,[],[],https://twitter.com/freddyhutasoit3/status/1444554688699846661,False,,0,,,,,,,,"[{'screen_name': 'yudiharahap46', 'name': 'Yudi Purnomo Harahap', 'id': '149066414'}]",,,,
1444550388317753346,1444550388317753346,2021-10-03 06:30:25 UTC,2021-10-03,06:30:25,+0000,175442007,ecosocrights,InstitutEcosocRights,,Bukti bahwa penyingkiran pegawai KPK berintegritas dan berprestasi dgn narasi Taliban dan tes TWK adalah satu paket dgn revisi UU KPK utk pelemahan KPK. Kini yg melemahkan KPK terbelit dan terjebak dgn narasinya sendiri. Tidak ada kejahatan yg tdk meninggalkan jejak.,in,[],[],[],0,10,24,[],[],https://twitter.com/ecosocrights/status/1444550388317753346,False,https://twitter.com/tatakhoiriyah/status/1444508119325839364,0,,,,,,,,[],,,,
1444521154492858369,1444085280651108355,2021-10-03 04:34:15 UTC,2021-10-03,04:34:15,+0000,779335173892550656,rikirsikumbang,Riki Risman,,"@Hey_Himawan @FerdinandHaean3 Bukan lemah sama pemprov DKI, karena memang tidak bisa membuktikan kesalahannya... Yang melemahkan KPK itu ya yg kelompok Harun Masiku, Juliari Batubara sama konco2nya...",in,[],[],[],0,0,0,[],[],https://twitter.com/RikiRSikumbang/status/1444521154492858369,False,,0,,,,,,,,"[{'screen_name': 'Hey_Himawan', 'name': 'Himawan', 'id': '1096071815837843457'}, {'screen_name': 'FerdinandHaean3', 'name': 'Ferdinand Hutahaean', 'id': '1266163382807224320'}]",,,,
1444484315119702021,1444484135276347397,2021-10-03 02:07:52 UTC,2021-10-03,02:07:52,+0000,1400445820604870661,geolapendos,Geo Lapendos,,Isu pelemahan KPK tidak relevan  https://t.co/XOeZXxunXW,in,[],[],['https://pbs.twimg.com/media/FAvW0pDVUAEXh82.jpg'],0,0,0,[],[],https://twitter.com/GeoLapendos/status/1444484315119702021,False,,1,https://pbs.twimg.com/media/FAvW0pDVUAEXh82.jpg,,,,,,,[],,,,
1444484302457032707,1444484135276347397,2021-10-03 02:07:49 UTC,2021-10-03,02:07:49,+0000,1400445820604870661,geolapendos,Geo Lapendos,,Isu pelemahan KPK tidak relevan  https://t.co/6iu3ZhL1ad,in,[],[],['https://pbs.twimg.com/media/FAvW0B1VkAED4wA.jpg'],1,0,0,[],[],https://twitter.com/GeoLapendos/status/1444484302457032707,False,,1,https://pbs.twimg.com/media/FAvW0B1VkAED4wA.jpg,,,,,,,[],,,,
1444484291916795905,1444484135276347397,2021-10-03 02:07:47 UTC,2021-10-03,02:07:47,+0000,1400445820604870661,geolapendos,Geo Lapendos,,Isu pelemahan KPK tidak relevan  https://t.co/u9lUNhGcCG,in,[],[],['https://pbs.twimg.com/media/FAvWzV0VcAAe7aG.jpg'],1,0,0,[],[],https://twitter.com/GeoLapendos/status/1444484291916795905,False,,1,https://pbs.twimg.com/media/FAvWzV0VcAAe7aG.jpg,,,,,,,[],,,,
1444484278968934403,1444484135276347397,2021-10-03 02:07:43 UTC,2021-10-03,02:07:43,+0000,1400445820604870661,geolapendos,Geo Lapendos,,Isu pelemahan KPK tidak relevan  https://t.co/BtLSDu8QIA,in,[],[],['https://pbs.twimg.com/media/FAvWyisVQAMeIVO.jpg'],1,0,0,[],[],https://twitter.com/GeoLapendos/status/1444484278968934403,False,,1,https://pbs.twimg.com/media/FAvWyisVQAMeIVO.jpg,,,,,,,[],,,,
1444484266226716673,1444484135276347397,2021-10-03 02:07:40 UTC,2021-10-03,02:07:40,+0000,1400445820604870661,geolapendos,Geo Lapendos,,Isu pelemahan KPK tidak relevan  https://t.co/8heUpP3d4m,in,[],[],['https://pbs.twimg.com/media/FAvWx6XVcAUysgV.jpg'],1,0,0,[],[],https://twitter.com/GeoLapendos/status/1444484266226716673,False,,1,https://pbs.twimg.com/media/FAvWx6XVcAUysgV.jpg,,,,,,,[],,,,
1444484255115923461,1444484135276347397,2021-10-03 02:07:38 UTC,2021-10-03,02:07:38,+0000,1400445820604870661,geolapendos,Geo Lapendos,,Isu pelemahan KPK tidak relevan  https://t.co/r9pMckjoA7,in,[],[],['https://pbs.twimg.com/media/FAvWxNXVUAAYMLf.jpg'],1,0,0,[],[],https://twitter.com/GeoLapendos/status/1444484255115923461,False,,1,https://pbs.twimg.com/media/FAvWxNXVUAAYMLf.jpg,,,,,,,[],,,,
1444484243518676995,1444484135276347397,2021-10-03 02:07:35 UTC,2021-10-03,02:07:35,+0000,1400445820604870661,geolapendos,Geo Lapendos,,Isu pelemahan KPK tidak relevan  https://t.co/LJ2rBpKhMc,in,[],[],['https://pbs.twimg.com/media/FAvWwfQVQAM5yHX.jpg'],1,0,0,[],[],https://twitter.com/GeoLapendos/status/1444484243518676995,False,,1,https://pbs.twimg.com/media/FAvWwfQVQAM5yHX.jpg,,,,,,,[],,,,
1444484230990360581,1444484135276347397,2021-10-03 02:07:32 UTC,2021-10-03,02:07:32,+0000,1400445820604870661,geolapendos,Geo Lapendos,,Isu pelemahan KPK tidak relevan  https://t.co/wxGhlQ2PcK,in,[],[],['https://pbs.twimg.com/media/FAvWvwUUYAISTF9.jpg'],1,0,0,[],[],https://twitter.com/GeoLapendos/status/1444484230990360581,False,,1,https://pbs.twimg.com/media/FAvWvwUUYAISTF9.jpg,,,,,,,[],,,,
1444484218487066627,1444484135276347397,2021-10-03 02:07:29 UTC,2021-10-03,02:07:29,+0000,1400445820604870661,geolapendos,Geo Lapendos,,Isu pelemahan KPK tidak relevan  https://t.co/a84eO56vsM,in,[],[],['https://pbs.twimg.com/media/FAvWvIHVIAU1eP7.jpg'],1,0,0,[],[],https://twitter.com/GeoLapendos/status/1444484218487066627,False,,1,https://pbs.twimg.com/media/FAvWvIHVIAU1eP7.jpg,,,,,,,[],,,,
1444484207430963205,1444484135276347397,2021-10-03 02:07:26 UTC,2021-10-03,02:07:26,+0000,1400445820604870661,geolapendos,Geo Lapendos,,Isu pelemahan KPK tidak relevan  https://t.co/XkXvJYEcqP,in,[],[],['https://pbs.twimg.com/media/FAvWuZ4UUAAwTkV.jpg'],1,0,0,[],[],https://twitter.com/GeoLapendos/status/1444484207430963205,False,,1,https://pbs.twimg.com/media/FAvWuZ4UUAAwTkV.jpg,,,,,,,[],,,,
1444484195187769345,1444484135276347397,2021-10-03 02:07:24 UTC,2021-10-03,02:07:24,+0000,1400445820604870661,geolapendos,Geo Lapendos,,Isu pelemahan KPK tidak relevan  https://t.co/YQqHvGK9NE,in,[],[],['https://pbs.twimg.com/media/FAvWtltVEAAVWlH.jpg'],1,0,0,[],[],https://twitter.com/GeoLapendos/status/1444484195187769345,False,,1,https://pbs.twimg.com/media/FAvWtltVEAAVWlH.jpg,,,,,,,[],,,,
1444484180776153091,1444484135276347397,2021-10-03 02:07:20 UTC,2021-10-03,02:07:20,+0000,1400445820604870661,geolapendos,Geo Lapendos,,Isu pelemahan KPK tidak relevan  https://t.co/l0jqEZVuq8,in,[],[],['https://pbs.twimg.com/media/FAvWs0xUcAAS0yJ.jpg'],1,0,0,[],[],https://twitter.com/GeoLapendos/status/1444484180776153091,False,,1,https://pbs.twimg.com/media/FAvWs0xUcAAS0yJ.jpg,,,,,,,[],,,,
1444484168042233857,1444484135276347397,2021-10-03 02:07:17 UTC,2021-10-03,02:07:17,+0000,1400445820604870661,geolapendos,Geo Lapendos,,Isu pelemahan KPK tidak relevan  https://t.co/ZVp4sHQBcT,in,[],[],['https://pbs.twimg.com/media/FAvWsAQUYAAeQHe.jpg'],1,0,0,[],[],https://twitter.com/GeoLapendos/status/1444484168042233857,False,,1,https://pbs.twimg.com/media/FAvWsAQUYAAeQHe.jpg,,,,,,,[],,,,
1444484153907367941,1444484135276347397,2021-10-03 02:07:14 UTC,2021-10-03,02:07:14,+0000,1400445820604870661,geolapendos,Geo Lapendos,,Isu pelemahan KPK tidak relevan  https://t.co/hIxdQchotr,in,[],[],['https://pbs.twimg.com/media/FAvWrrOVIAUCN2Q.jpg'],1,0,0,[],[],https://twitter.com/GeoLapendos/status/1444484153907367941,False,,1,https://pbs.twimg.com/media/FAvWrrOVIAUCN2Q.jpg,,,,,,,[],,,,
1444484146458333186,1444484135276347397,2021-10-03 02:07:12 UTC,2021-10-03,02:07:12,+0000,1400445820604870661,geolapendos,Geo Lapendos,,Isu pelemahan KPK tidak relevan  https://t.co/dLTPPfIAt5,in,[],[],['https://pbs.twimg.com/media/FAvWq7AVEAcOV0x.jpg'],1,0,0,[],[],https://twitter.com/GeoLapendos/status/1444484146458333186,False,,1,https://pbs.twimg.com/media/FAvWq7AVEAcOV0x.jpg,,,,,,,[],,,,
